{
  "schema_version": "1.0.0",
  "version_id": "ver_01HZX8B7J2V3M4N5P6Q7R8S9T0",
  "asset_id": "asset_01HZX8A7J2V3M4N5P6Q7R8S9T0",
  "lineage": {
    "created_at": "2026-04-14T20:20:05Z",
    "created_by": "modules/io",
    "reason": "initial import"
  },
  "audio": {
    "storage_ref": "storage/audio/ver_01HZX8B7J2V3M4N5P6Q7R8S9T0.wav",
    "sample_rate_hz": 44100,
    "channels": 2,
    "duration_seconds": 4.0,
    "frame_count": 176400,
    "channel_layout": "stereo"
  },
  "state": {
    "is_original": true,
    "is_preview": false
  }
}
